  {
    "productId": 1,
    "productName": "S/4 HANA",
    "price": 1000,
    "image": "",
    "description": "Intelligent ERP solution that enables companies to capture every opportunity in today's digital world, SAP S/4HANA removes common obstacles associated with legacy ERP applications, such as batch latency, complex landscapes, and manually-driven processes"
  }